,0,full_statement,sentiment,GF_complexity
57,Karen Short,"Hi. Thanks very much. I don’t think you said this or if you didn’t missed it. When you look at your EBIT ranges for 2021, can you just give a little color on what you are assuming on comps? And then I guess following on that is, when we think history of food retailers, when you are lapping very high comps, retailers tend to get irrational, we are respective of whether they should or shouldn’t. So how are you thinking about the competitive landscape next year is as you are all of you lapped even unusually high comps, and then I had one quick follow-up?",0.1082037037037037,10.69
58,Jack Sinclair,"Sure. Can we clearly we scratch our heads and talk about what’s going to happen next year, a lot in terms of the microenvironment. And there was some extraordinary March, April, June times in terms of cons across the industry, and clearly lapping those -- that I think it’s going to be -- I think it’s going to be more rational because it’s so extreme what happened last year.,If I am all of this year, what ended the moment? What happened earlier on in the year? I think there will be more rational because your arm in that normal environment count where you get a great number and then you think, how am I going to lap it.,I think most retailers will be taken particularly food retailers will be taking the view that was extraordinary and lapping that is going to be unrealistic without killing any sense of profitability. I am talking about other people in this conversation here.,With regard to us, we talked about this long before the pandemic, and we are going to be talking about it long after the pandemic. How do we target our customers and how do we play our own game? And that will deliver substantial growth for us going forward.,The combination of new stores, e-commerce and in-store comp. We are very confident as we work the tactics through that we have got a long-term runway of growth in our business. How that works within the environment, we will be being rational and we will be playing our own game.,As we target our customers that are very in tune with the proposition that we are putting in front of them. And we do believe we are very different to a normal food grocery retailer, who you would be traditionally seeing could affect us if there is an irrational environment. So one, I think the rational environment will be rational.,If it’s not, we are going to keep playing our own game because we are pretty confident that’s the right place for us to be. And there is plenty of opportunities for us to grow our business, whether it be rational or irrational in the marketplace as we play our own game as a safe.",0.19459475709475707,14.64
59,Operator,Thank you. I will now turn…,0.0,2.4
60,Jack Sinclair,Yeah. [Inaudible] Sorry.,-0.5,14.53
61,Operator,I will now turn the call back over to CEO Jack Sinclair for any closing remarks.,0.0,6.4
62,Jack Sinclair,"Hi. Thanks ever so much guys for spending some time listening to it this afternoon. We really appreciate your interest in our company and it’s an exciting place to be at the moment. We are really thrilled with the opportunity that’s in front of us here at Sprouts. And I appreciate you taking some time and please stay safe and look after yourselves guys. Thanks ever so much,",0.30000000000000004,7.79
63,Operator,"Ladies and gentlemen, thanks for participating in today’s conference. This does conclude the program and you may now disconnect.",0.2,10.12
